[
  {
    "id": "agama.konghucu-taoisme.sejarah-penyebaran",
    "judul": "Sejarah dan Penyebaran Konghucu dan Taoisme",
    "kategori": "agama",
    "subkategori": "konghucu-taoisme",
    "periode": {
      "mulai": "-551",
      "selesai": "-400",
      "label": "sekitar 551 - 400 SM (masa hidup Konfusius dan Lao Tzu)"
    },
    "ringkasan": "Dua tradisi ajaran besar dari Tiongkok kuno, Konghucu yang menekankan etika sosial dan Taoisme yang menekankan keselarasan dengan alam, sama-sama sangat memengaruhi budaya Asia Timur.",
    "konten": "Konghucu (Confucianism) berkembang dari ajaran Konfusius (dalam bahasa Tionghoa disebut Kongzi), seorang filsuf dan guru yang hidup sekitar 551-479 SM di Tiongkok pada masa yang penuh gejolak politik dan sosial. Konfusius mengembangkan sistem pemikiran yang menekankan pentingnya etika, moralitas, dan tatanan sosial yang harmonis, dengan tujuan menciptakan masyarakat yang tertib dan sejahtera lewat perilaku individu yang baik dan hubungan sosial yang tepat.\n\nTaoisme (Daoism) berkembang hampir bersamaan, dikaitkan dengan tokoh legendaris Lao Tzu, yang menurut tradisi menulis kitab Tao Te Ching yang menjadi teks fundamental ajaran ini, meski keberadaan historis Lao Tzu sendiri masih diperdebatkan sejarawan. Berbeda dari Konghucu yang lebih fokus pada tatanan sosial dan etika, Taoisme lebih menekankan keselarasan dengan Tao (jalan atau prinsip alam semesta), mendorong kehidupan yang sederhana, selaras dengan alam, dan tidak memaksakan kehendak (konsep wu wei, atau tindakan tanpa paksaan).\n\nKedua tradisi ini berkembang dan hidup berdampingan selama ribuan tahun dalam budaya Tiongkok, sering kali saling melengkapi dalam kehidupan masyarakat Tiongkok tradisional — Konghucu lebih dominan dalam struktur formal masyarakat, pemerintahan, dan pendidikan, sementara Taoisme lebih berperan dalam aspek spiritual personal dan filosofi hidup individu. Kedua ajaran ini menyebar luas ke seluruh Asia Timur, termasuk Korea, Jepang, dan Vietnam, memengaruhi budaya, etika sosial, dan filsafat di kawasan tersebut secara mendalam. Di Indonesia, Konghucu diakui sebagai salah satu agama resmi yang dipeluk terutama komunitas Tionghoa Indonesia, sementara unsur-unsur Taoisme sering hadir berpadu dalam praktik keagamaan dan filosofis masyarakat Tionghoa perantauan di berbagai negara.",
    "tags": ["konghucu", "taoisme", "konfusius", "lao-tzu", "tiongkok"],
    "sumber": [],
    "tingkat_pembaca": "umum",
    "terakhir_diupdate": "2026-07-29"
  },
  {
    "id": "agama.konghucu-taoisme.ajaran-inti",
    "judul": "Ajaran Inti Konghucu dan Taoisme",
    "kategori": "agama",
    "subkategori": "konghucu-taoisme",
    "periode": {
      "label": "Ajaran dasar sejak era Konfusius dan Lao Tzu, dipegang teguh sampai sekarang"
    },
    "ringkasan": "Konghucu menekankan lima hubungan sosial dan kebajikan (ren), sementara Taoisme menekankan konsep Tao, yin-yang, dan wu wei sebagai prinsip menjalani kehidupan selaras alam.",
    "konten": "Ajaran inti Konghucu berpusat pada konsep ren (kebajikan atau cinta kasih kepada sesama), yang dianggap sebagai kualitas moral tertinggi yang harus dimiliki setiap individu. Konfusius juga mengajarkan pentingnya menjalankan lima hubungan sosial utama dengan tepat: hubungan penguasa-rakyat, ayah-anak, suami-istri, kakak-adik, dan sahabat-sahabat, masing-masing dengan kewajiban dan etika yang sesuai. Konsep li (tata krama atau ritual yang tepat) juga sangat penting dalam ajaran Konghucu, menekankan pentingnya perilaku yang sesuai norma sosial dan penghormatan terhadap hierarki serta tradisi, termasuk penghormatan mendalam kepada orang tua dan leluhur (disebut xiao atau bakti).\n\nSementara itu, ajaran inti Taoisme berpusat pada konsep Tao, yang secara harfiah berarti \"jalan\", merujuk pada prinsip atau kekuatan fundamental yang mengatur alam semesta, yang menurut Taoisme tidak bisa sepenuhnya dijelaskan dengan kata-kata namun bisa dipahami dan dijalani lewat pengalaman hidup yang selaras dengannya. Konsep yin-yang, dua kekuatan yang berlawanan namun saling melengkapi (seperti gelap-terang, lembut-keras, pasif-aktif), juga sangat sentral dalam filosofi Taoisme, menggambarkan bagaimana keseimbangan antara kekuatan-kekuatan berlawanan ini menciptakan harmoni dalam alam semesta.\n\nKonsep wu wei, sering diterjemahkan sebagai \"tindakan tanpa paksaan\" atau \"tidak melakukan\", adalah prinsip penting lain dalam Taoisme, mengajarkan bahwa cara terbaik menjalani hidup adalah mengalir selaras dengan alam tanpa memaksakan kehendak atau melawan arus alami kehidupan, mirip air yang mengalir mengikuti bentuk wadahnya tanpa perlawanan namun tetap mampu mengikis batu keras dalam jangka panjang. Meski Konghucu dan Taoisme punya penekanan berbeda — satu lebih pada tatanan sosial, satu lagi pada keselarasan alam — keduanya sama-sama sangat memengaruhi cara pandang dan filosofi hidup masyarakat Tiongkok dan Asia Timur secara luas selama ribuan tahun.",
    "tags": ["ren", "tao", "yin-yang", "wu-wei", "li"],
    "sumber": [],
    "tingkat_pembaca": "umum",
    "terakhir_diupdate": "2026-07-29"
  },
  {
    "id": "agama.konghucu-taoisme.praktik-ibadah",
    "judul": "Praktik Ibadah dalam Konghucu dan Taoisme",
    "kategori": "agama",
    "subkategori": "konghucu-taoisme",
    "periode": {
      "label": "Praktik yang berkembang sejak era kuno, dipraktikkan sampai sekarang dengan variasi regional"
    },
    "ringkasan": "Penghormatan leluhur dan perayaan Imlek dalam Konghucu, serta meditasi dan praktik kesehatan seperti tai chi dalam Taoisme, jadi bentuk-bentuk utama praktik kedua tradisi ini.",
    "konten": "Praktik keagamaan dalam tradisi Konghucu sangat menekankan penghormatan kepada leluhur, dengan berbagai ritual dan upacara yang dilakukan untuk menghormati arwah nenek moyang, termasuk mempersembahkan dupa, makanan, dan doa di altar keluarga atau kuil leluhur. Praktik ini mencerminkan penekanan kuat Konghucu terhadap nilai bakti dan kesinambungan keluarga lintas generasi. Perayaan Tahun Baru Imlek, meski sering dianggap sebagai perayaan budaya Tionghoa secara umum, juga punya akar dan makna yang berkaitan dengan nilai-nilai Konghucu tentang keluarga, penghormatan leluhur, dan harmoni sosial, menjadi momen penting berkumpulnya keluarga besar.\n\nDi kuil-kuil Konghucu, terutama yang didedikasikan untuk menghormati Konfusius sendiri, upacara-upacara formal dilakukan pada waktu-waktu tertentu, termasuk peringatan hari lahir Konfusius, melibatkan ritual yang menekankan tata krama dan penghormatan sesuai ajaran li yang diajarkan Konfusius sendiri. Pendidikan dan pembelajaran juga dianggap sebagai bentuk praktik penting dalam Konghucu, karena Konfusius sangat menekankan pentingnya belajar dan pengembangan moral diri sepanjang hidup.\n\nDalam Taoisme, praktik meditasi dan berbagai teknik olah napas menjadi cara penting untuk mencapai keselarasan dengan Tao, sering kali dipadukan dengan praktik kesehatan dan gerakan tubuh seperti tai chi (taiji) dan qigong, yang menggabungkan gerakan lambat dan terkontrol dengan pernapasan dalam untuk menyeimbangkan energi vital tubuh (disebut qi). Kuil-kuil Taois juga menjadi tempat penting bagi ritual dan pemujaan berbagai dewa dalam pantheon Taoisme yang kaya, sementara praktik pengobatan tradisional Tiongkok, termasuk akupunktur dan penggunaan ramuan herbal, juga berakar dari filosofi keseimbangan yin-yang dan aliran qi yang menjadi inti ajaran Taoisme, menunjukkan bagaimana tradisi ini tidak hanya bersifat spiritual tapi juga sangat praktis memengaruhi kehidupan sehari-hari masyarakat Tiongkok.",
    "tags": ["penghormatan-leluhur", "imlek", "tai-chi", "qigong", "kuil-konghucu"],
    "sumber": [],
    "tingkat_pembaca": "umum",
    "terakhir_diupdate": "2026-07-29"
  }
]
