[
  {
    "id": "sains.astronomi.materi-gelap",
    "judul": "Materi Gelap: Massa Tersembunyi di Alam Semesta",
    "kategori": "sains",
    "subkategori": "astronomi",
    "periode": {
      "label": "Bukti awal diajukan Fritz Zwicky pada 1933, terus diteliti hingga kini"
    },
    "ringkasan": "Materi gelap adalah jenis materi misterius yang tidak memancarkan atau menyerap cahaya, sehingga tidak bisa diamati secara langsung, namun keberadaannya terbukti lewat pengaruh gravitasinya yang sangat besar terhadap pergerakan bintang dan galaksi.",
    "konten": "Materi gelap adalah salah satu misteri terbesar yang masih belum terpecahkan dalam astronomi dan fisika modern, merujuk pada jenis materi yang diyakini keberadaannya karena pengaruh gravitasinya yang nyata dan terukur, namun tidak bisa diamati secara langsung karena tidak memancarkan, menyerap, atau memantulkan cahaya maupun radiasi elektromagnetik lain dalam bentuk apa pun yang bisa dideteksi dengan teknologi pengamatan yang ada sekarang. Petunjuk awal tentang keberadaan materi gelap pertama kali diajukan astronom Swiss-Amerika bernama Fritz Zwicky pada 1933, ketika ia mengamati bahwa galaksi-galaksi dalam suatu gugus galaksi bergerak jauh lebih cepat dibanding yang seharusnya diperkirakan berdasarkan jumlah massa yang bisa diamati secara langsung dari cahaya yang dipancarkan galaksi-galaksi tersebut, menyiratkan harus ada massa tambahan yang tidak terlihat namun memberi gaya gravitasi ekstra yang menjaga galaksi-galaksi tersebut tetap terikat bersama dalam gugus.\n\nBukti yang lebih kuat dan lebih diterima luas datang beberapa dekade kemudian, terutama dari penelitian astronom Amerika bernama Vera Rubin pada 1970-an, yang mengukur kecepatan rotasi bintang-bintang pada berbagai jarak dari pusat galaksi spiral. Berdasarkan hukum fisika standar, bintang yang posisinya lebih jauh dari pusat galaksi seharusnya bergerak lebih lambat, mirip seperti planet yang lebih jauh dari matahari bergerak lebih lambat mengelilingi orbitnya. Namun pengamatan Rubin menunjukkan bintang-bintang di bagian luar galaksi justru bergerak dengan kecepatan yang hampir sama dengan bintang-bintang yang lebih dekat ke pusat, pola yang hanya bisa dijelaskan kalau galaksi tersebut dikelilingi oleh 'halo' materi tambahan yang tidak terlihat, tersebar jauh lebih luas dibanding sebaran bintang yang bisa diamati, memberi gravitasi ekstra yang memengaruhi pergerakan bintang-bintang di bagian terluar galaksi.\n\nMeski keberadaannya sudah didukung bukti pengamatan yang sangat kuat dan konsisten dari berbagai metode berbeda, sifat sesungguhnya dari materi gelap masih jadi misteri besar yang terus diteliti hingga sekarang. Materi gelap jelas berbeda dari materi biasa yang menyusun bintang, planet, dan segala sesuatu yang bisa kita lihat, karena tidak berinteraksi dengan cahaya sama sekali, hanya tampak berinteraksi lewat gaya gravitasi. Berbagai kandidat partikel telah diusulkan sebagai penyusun materi gelap, namun hingga sekarang belum ada satu pun yang berhasil dideteksi secara langsung lewat eksperimen di laboratorium, meski berbagai percobaan canggih terus dilakukan di seluruh dunia untuk mencoba menangkap dan mengidentifikasi partikel materi gelap ini secara langsung, menjadikan pemahaman tentang materi gelap sebagai salah satu tantangan terbesar yang masih dihadapi fisika dan astronomi modern.",
    "tags": ["materi-gelap", "fritz-zwicky", "vera-rubin", "kecepatan-rotasi-galaksi", "gravitasi"],
    "sumber": [],
    "tingkat_pembaca": "umum",
    "terakhir_diupdate": "2026-10-18"
  },
  {
    "id": "sains.astronomi.energi-gelap",
    "judul": "Energi Gelap dan Ekspansi yang Semakin Cepat",
    "kategori": "sains",
    "subkategori": "astronomi",
    "periode": {
      "label": "Ditemukan lewat pengamatan supernova pada 1998"
    },
    "ringkasan": "Energi gelap adalah kekuatan misterius yang diyakini menyebabkan ekspansi alam semesta semakin cepat alih-alih melambat seperti yang sebelumnya diperkirakan, dan diperkirakan mencakup proporsi terbesar dari seluruh kandungan energi dan materi di alam semesta.",
    "konten": "Sebelum akhir 1990-an, sebagian besar astronom memperkirakan bahwa ekspansi alam semesta, meski terus berlangsung sejak Big Bang, seharusnya melambat seiring waktu, akibat gaya gravitasi dari seluruh materi di alam semesta yang terus menarik satu sama lain, serupa seperti bola yang dilempar ke atas akan melambat akibat tarikan gravitasi bumi. Namun pada 1998, dua tim astronom independen yang meneliti supernova jarak jauh menemukan hasil yang sangat mengejutkan dan berlawanan dengan perkiraan sebelumnya: alam semesta ternyata tidak melambat ekspansinya, melainkan justru semakin cepat mengembang seiring waktu, sebuah penemuan yang begitu penting hingga para ilmuwan utama di balik penelitian ini dianugerahi Hadiah Nobel Fisika pada 2011.\n\nUntuk menjelaskan percepatan ekspansi yang tidak terduga ini, para ilmuwan mengajukan konsep energi gelap, suatu bentuk energi misterius yang diyakini mengisi seluruh ruang alam semesta dan memiliki sifat unik, yaitu menghasilkan gaya yang bersifat menolak atau mendorong, berlawanan dengan gravitasi biasa yang sifatnya menarik. Berbeda dari materi gelap yang pengaruhnya terasa lewat gravitasi tarik-menarik yang memengaruhi pergerakan bintang dan galaksi pada skala relatif lokal, energi gelap tampaknya bekerja pada skala alam semesta secara keseluruhan, mendorong ruang itu sendiri untuk terus mengembang dengan laju yang semakin cepat dari waktu ke waktu.\n\nMeski keberadaannya didukung bukti pengamatan yang kuat, sifat sesungguhnya dari energi gelap bahkan lebih misterius dan kurang dipahami dibanding materi gelap. Berdasarkan perhitungan kosmologis, energi gelap diperkirakan mencakup sekitar 68 persen dari total kandungan energi dan materi di seluruh alam semesta, jauh melampaui proporsi materi gelap (sekitar 27 persen) maupun materi biasa yang menyusun bintang dan planet (hanya sekitar 5 persen), berarti sebagian besar 'isi' alam semesta kita sebenarnya tersusun dari sesuatu yang masih sangat sedikit dipahami manusia. Salah satu penjelasan yang diajukan adalah energi gelap mungkin berkaitan dengan energi yang secara inheren melekat pada ruang hampa itu sendiri, sebuah konsep yang berasal dari teori fisika kuantum, meski perhitungan berdasarkan teori ini menghasilkan nilai yang sangat jauh berbeda dari yang diamati secara nyata, menunjukkan bahwa pemahaman penuh tentang energi gelap masih jadi salah satu pertanyaan besar yang belum terjawab dalam fisika dan kosmologi modern, menjadi area penelitian aktif yang terus berusaha dipahami lebih dalam oleh para ilmuwan hingga saat ini.",
    "tags": ["energi-gelap", "ekspansi-alam-semesta", "supernova", "hadiah-nobel-fisika", "kosmologi"],
    "sumber": [],
    "tingkat_pembaca": "umum",
    "terakhir_diupdate": "2026-10-18"
  }
]
