[
  {
    "id": "sains.matematika.konsep-limit",
    "judul": "Konsep Limit dalam Kalkulus",
    "kategori": "sains",
    "subkategori": "matematika",
    "periode": {
      "label": "Konsep dasar ilmu matematika, tidak terikat periode waktu tertentu"
    },
    "ringkasan": "Limit adalah konsep dasar kalkulus yang mempelajari perilaku suatu fungsi ketika nilai input mendekati suatu titik tertentu, bahkan ketika nilai persis di titik tersebut mungkin tidak terdefinisikan atau sulit dihitung secara langsung.",
    "konten": "Limit adalah salah satu konsep paling fundamental dalam kalkulus, cabang matematika yang mempelajari perubahan dan gerakan secara mendalam. Secara sederhana, limit membahas apa yang terjadi pada nilai suatu fungsi ketika input yang dimasukkan semakin mendekati suatu nilai tertentu, meski belum tentu benar-benar mencapai nilai tersebut secara persis. Konsep ini penting karena ada banyak situasi matematis di mana kita ingin mengetahui perilaku suatu fungsi di sekitar titik tertentu, meski nilai fungsi tepat di titik tersebut mungkin tidak terdefinisikan atau sulit dihitung secara langsung.\n\nContoh klasik untuk memahami limit adalah membayangkan sebuah fungsi f(x) = (x² - 1)/(x - 1). Kalau kita mencoba memasukkan nilai x = 1 secara langsung ke dalam fungsi ini, kita akan mendapat pembagian 0/0, yang secara matematis tidak terdefinisikan, sehingga tidak bisa langsung dihitung. Namun, kita tetap bisa menyelidiki apa yang terjadi pada nilai fungsi tersebut ketika x semakin mendekati 1 dari kedua arah, baik dari nilai sedikit di bawah 1 maupun sedikit di atas 1. Kalau dihitung secara teliti, ternyata nilai fungsi ini semakin mendekati angka 2 seiring x mendekati 1, meski nilai tepat di x = 1 sendiri memang tidak terdefinisikan — inilah yang dimaksud dengan 'limit fungsi tersebut ketika x mendekati 1 adalah 2', dituliskan dalam notasi matematika sebagai lim(x→1) f(x) = 2.\n\nKonsep limit menjadi fondasi penting yang memungkinkan pengembangan dua operasi utama dalam kalkulus, yaitu turunan dan integral, yang keduanya pada dasarnya dibangun di atas ide dasar limit ini. Limit juga membantu menjelaskan dan memahami berbagai fenomena yang melibatkan perubahan sangat kecil atau proses yang berlangsung tanpa henti mendekati suatu batas tertentu, seperti bagaimana kecepatan sesaat suatu benda yang bergerak bisa dihitung dengan memeriksa limit dari perubahan posisi dibagi perubahan waktu, ketika selang waktu yang diperiksa semakin diperkecil mendekati nol tanpa pernah benar-benar mencapai nol itu sendiri, memungkinkan kita memahami gerakan pada satu momen spesifik meski secara intuitif 'kecepatan sesaat' pada satu titik waktu tunggal terdengar seperti konsep yang kontradiktif tanpa bantuan limit untuk menjelaskannya secara matematis dengan tepat.",
    "tags": ["limit", "kalkulus", "fungsi", "turunan", "integral"],
    "sumber": [],
    "tingkat_pembaca": "umum",
    "terakhir_diupdate": "2026-10-18"
  },
  {
    "id": "sains.matematika.konsep-turunan",
    "judul": "Konsep Turunan: Mengukur Laju Perubahan",
    "kategori": "sains",
    "subkategori": "matematika",
    "periode": {
      "label": "Dikembangkan secara independen oleh Isaac Newton dan Gottfried Leibniz pada akhir abad ke-17"
    },
    "ringkasan": "Turunan adalah konsep kalkulus yang mengukur seberapa cepat suatu fungsi berubah pada titik tertentu, secara geometris setara dengan kemiringan garis singgung pada kurva fungsi tersebut, dan punya penerapan luas untuk mengukur kecepatan, percepatan, dan berbagai laju perubahan lainnya.",
    "konten": "Turunan adalah konsep kalkulus yang mengukur seberapa cepat nilai suatu fungsi berubah pada suatu titik tertentu, pada dasarnya menjawab pertanyaan 'seberapa curam' atau 'seberapa cepat naik-turunnya' suatu fungsi di titik tersebut. Konsep ini dikembangkan secara independen oleh dua matematikawan besar pada akhir abad ke-17, yaitu Isaac Newton dari Inggris dan Gottfried Leibniz dari Jerman, masing-masing mengembangkan notasi dan pendekatan yang sedikit berbeda namun pada dasarnya mengarah pada konsep matematis yang sama, dan keduanya kini sama-sama diakui sebagai penemu kalkulus modern.\n\nSecara geometris, turunan suatu fungsi pada titik tertentu setara dengan kemiringan garis singgung pada kurva fungsi tersebut di titik itu, yaitu garis lurus yang hanya menyentuh kurva pada satu titik saja tanpa memotongnya, mengikuti arah kecenderungan kurva tepat di titik tersebut. Untuk menghitung turunan, matematikawan memakai konsep limit yang sudah dibahas sebelumnya — turunan pada dasarnya dihitung dengan memeriksa bagaimana perubahan nilai fungsi dibanding perubahan nilai input, ketika perubahan input tersebut dibuat semakin kecil mendekati nol, mendekati limit dari rasio perubahan tersebut. Proses mencari turunan suatu fungsi disebut diferensiasi.\n\nTurunan punya penerapan sangat luas dalam berbagai bidang ilmu, terutama karena kemampuannya mengukur laju perubahan secara umum, tidak terbatas hanya pada konteks matematika murni. Dalam fisika, turunan posisi suatu benda terhadap waktu memberikan kecepatan benda tersebut, dan turunan dari kecepatan itu sendiri terhadap waktu memberikan percepatan, menjelaskan bagaimana konsep-konsep gerak yang familiar sebenarnya bisa dipahami dengan sangat presisi lewat bahasa turunan kalkulus. Dalam bidang ekonomi, turunan dipakai untuk menganalisis bagaimana biaya produksi berubah seiring perubahan jumlah barang yang diproduksi, membantu perusahaan menentukan tingkat produksi paling optimal. Bahkan dalam kehidupan sehari-hari, konsep turunan secara implisit sering kita pakai tanpa sadar, misalnya ketika mengamati speedometer mobil yang pada dasarnya menunjukkan turunan posisi mobil terhadap waktu secara real time, memberi tahu kita seberapa cepat posisi mobil sedang berubah pada momen tertentu.",
    "tags": ["turunan", "kalkulus", "isaac-newton", "gottfried-leibniz", "diferensiasi", "kecepatan"],
    "sumber": [],
    "tingkat_pembaca": "umum",
    "terakhir_diupdate": "2026-10-18"
  }
]
