[
  {
    "id": "sejarah-indonesia.kontemporer.era-jokowi",
    "judul": "Era Presiden Joko Widodo (Jokowi)",
    "kategori": "sejarah-indonesia",
    "subkategori": "kontemporer",
    "periode": {
      "mulai": "2014",
      "selesai": "2024",
      "label": "20 Oktober 2014 - 20 Oktober 2024"
    },
    "ringkasan": "Presiden pertama dari luar kalangan elite politik/militer tradisional, dikenal lewat fokus pembangunan infrastruktur besar-besaran dan pemindahan ibu kota ke IKN Nusantara.",
    "konten": "Joko Widodo, yang akrab disapa Jokowi, terpilih jadi presiden ketujuh Indonesia pada 2014 dan kembali menang periode kedua pada 2019, menjadi presiden pertama pasca reformasi yang latar belakangnya bukan dari kalangan elite politik tradisional atau militer, melainkan mantan pengusaha mebel yang meniti karier politik dari wali kota Solo, lalu Gubernur DKI Jakarta, sebelum akhirnya jadi presiden.\n\nCiri khas kepemimpinan Jokowi yang paling menonjol adalah fokusnya yang sangat besar pada pembangunan infrastruktur — jalan tol trans-Jawa dan trans-Sumatra, bandara baru di berbagai daerah, bendungan, hingga proyek kereta cepat Jakarta-Bandung yang jadi kereta cepat pertama di Asia Tenggara. Pendekatan pembangunan yang masif ini sering disebut sebagai salah satu warisan paling signifikan dari era kepemimpinannya, meski juga menuai kritik terkait pembiayaan utang dan dampak lingkungan di beberapa proyek.\n\nKeputusan paling monumental sekaligus kontroversial di era Jokowi adalah rencana pemindahan ibu kota negara dari Jakarta ke Ibu Kota Nusantara (IKN) di Kalimantan Timur, yang mulai dibangun sejak 2022 dengan alasan utama mengurangi beban Jakarta yang sudah sangat padat dan rawan tenggelam, sekaligus pemerataan pembangunan ke luar Pulau Jawa. Selain itu, era Jokowi juga diwarnai tantangan besar seperti penanganan pandemi COVID-19 yang melanda dunia mulai 2020, yang berdampak besar pada ekonomi dan kehidupan sosial masyarakat Indonesia selama beberapa tahun.",
    "tags": ["jokowi", "joko-widodo", "ikn-nusantara", "infrastruktur", "covid-19"],
    "sumber": [],
    "tingkat_pembaca": "umum",
    "terakhir_diupdate": "2026-07-22"
  }
]
