[
  {
    "id": "sejarah-indonesia.kerajaan.mataram-kuno",
    "judul": "Kerajaan Mataram Kuno",
    "kategori": "sejarah-indonesia",
    "subkategori": "kerajaan",
    "periode": {
      "mulai": "732",
      "selesai": "1007",
      "label": "sekitar abad ke-8 - awal abad ke-11 Masehi"
    },
    "ringkasan": "Kerajaan agraris besar di Jawa Tengah yang diperintah bergantian oleh dinasti Sanjaya (Hindu) dan Sailendra (Buddha), pembangun Candi Borobudur dan Prambanan.",
    "konten": "Mataram Kuno (sering juga disebut Mataram Hindu, untuk membedakan dari Kesultanan Mataram Islam yang muncul jauh belakangan) adalah kerajaan besar yang berpusat di Jawa Tengah, berkembang mulai abad ke-8 Masehi. Yang unik dari kerajaan ini adalah adanya dua dinasti yang silih berganti berkuasa: Sanjaya yang beraliran Hindu Siwa, dan Sailendra yang beraliran Buddha Mahayana — kadang malah berjalan berdampingan lewat perkawinan politik antar keluarga kerajaan.\n\nMataram Kuno paling dikenal lewat warisan arsitekturnya yang luar biasa. Dinasti Sailendra membangun Candi Borobudur, candi Buddha terbesar di dunia, sementara dinasti Sanjaya membangun kompleks Candi Prambanan yang megah untuk memuja Trimurti (Brahma, Wisnu, Siwa). Kedua candi ini sampai sekarang jadi bukti tingkat kecanggihan teknik konstruksi dan seni pahat masyarakat Jawa Kuno, sekaligus jadi Situs Warisan Dunia UNESCO.\n\nSekitar awal abad ke-10, pusat kekuasaan Mataram Kuno berpindah dari Jawa Tengah ke Jawa Timur, kemungkinan karena bencana alam (letusan gunung berapi) atau alasan politik/ekonomi yang belum sepenuhnya jelas bagi para sejarawan. Perpindahan ini menandai babak baru sejarah kerajaan Jawa, yang nantinya berkembang jadi kerajaan-kerajaan seperti Kediri dan Singasari.",
    "tags": ["mataram-kuno", "sanjaya", "sailendra", "borobudur", "prambanan", "jawa-tengah"],
    "sumber": [],
    "tingkat_pembaca": "umum",
    "terakhir_diupdate": "2026-07-22"
  },
  {
    "id": "sejarah-indonesia.kerajaan.candi-borobudur",
    "judul": "Candi Borobudur",
    "kategori": "sejarah-indonesia",
    "subkategori": "kerajaan",
    "periode": {
      "mulai": "750",
      "selesai": "842",
      "label": "dibangun sekitar 750-842 Masehi"
    },
    "ringkasan": "Candi Buddha terbesar di dunia, dibangun dinasti Sailendra, berbentuk stupa raksasa dengan ribuan relief yang menceritakan ajaran Buddha.",
    "konten": "Borobudur adalah monumen Buddha terbesar di dunia, dibangun oleh dinasti Sailendra di Jawa Tengah antara tahun 750-an hingga 842 Masehi. Bentuknya menyerupai gunung berundak raksasa, dengan struktur yang terdiri dari 6 teras persegi dan 3 teras melingkar di bagian atas, dimahkotai satu stupa utama di puncaknya — desain ini melambangkan konsep kosmologi Buddha tentang perjalanan menuju pencerahan.\n\nYang bikin Borobudur istimewa bukan cuma ukurannya, tapi juga jumlah relief yang menghiasi dindingnya — ada sekitar 2.670 panel relief dan 504 arca Buddha yang menceritakan berbagai kisah, mulai dari ajaran karma (Karmawibhangga), riwayat hidup Buddha (Lalitavistara), sampai kisah-kisah perjalanan mencari kebenaran (Jataka dan Gandavyuha). Kalau relief-relief ini dijejer, panjangnya bisa mencapai beberapa kilometer.\n\nBorobudur sempat \"hilang\" dari perhatian publik selama berabad-abad, terkubur abu vulkanik dan tertutup vegetasi, sebelum ditemukan kembali dan mulai dipugar pada masa kolonial Belanda di awal abad ke-19, dengan pemugaran besar-besaran terakhir dilakukan UNESCO pada 1970-an-1980-an. Kini Borobudur jadi Situs Warisan Dunia UNESCO sejak 1991 dan salah satu destinasi wisata serta ziarah Buddha paling penting di Asia Tenggara.",
    "tags": ["borobudur", "candi-buddha", "sailendra", "unesco", "relief", "jawa-tengah"],
    "sumber": [],
    "tingkat_pembaca": "umum",
    "terakhir_diupdate": "2026-07-22"
  },
  {
    "id": "sejarah-indonesia.kerajaan.candi-prambanan",
    "judul": "Candi Prambanan",
    "kategori": "sejarah-indonesia",
    "subkategori": "kerajaan",
    "periode": {
      "mulai": "850",
      "selesai": "850",
      "label": "dibangun sekitar pertengahan abad ke-9 Masehi"
    },
    "ringkasan": "Kompleks candi Hindu terbesar di Indonesia, dibangun dinasti Sanjaya untuk memuja Trimurti, terkenal dengan candi utamanya yang menjulang tinggi.",
    "konten": "Prambanan adalah kompleks candi Hindu terbesar di Indonesia, dibangun sekitar pertengahan abad ke-9 Masehi oleh dinasti Sanjaya, kemungkinan sebagai tandingan sekaligus pelengkap kejayaan Borobudur yang lebih dulu dibangun dinasti Sailendra. Kompleks ini didedikasikan untuk memuja Trimurti — tiga dewa utama dalam Hindu: Brahma (pencipta), Wisnu (pemelihara), dan Siwa (pemusnah).\n\nCandi utama Prambanan, yaitu Candi Siwa, adalah candi tertinggi di kompleks ini dengan tinggi mencapai sekitar 47 meter, menjadikannya lebih tinggi dari candi utama Borobudur. Di dalam candi ini terdapat arca Siwa yang megah, dan di sekelilingnya berdiri candi-candi lain yang didedikasikan untuk Brahma, Wisnu, serta candi-candi pendamping (wahana) untuk kendaraan para dewa tersebut.\n\nSalah satu daya tarik Prambanan adalah relief-relief yang mengukir kisah epik Ramayana di dinding candi Siwa dan Brahma — cerita yang sampai sekarang masih sering dipentaskan dalam bentuk sendratari di area kompleks candi, terutama saat malam bulan purnama. Sama seperti Borobudur, Prambanan sempat rusak parah akibat gempa bumi dan letusan gunung berapi sepanjang sejarahnya, termasuk gempa besar tahun 2006, namun terus dipugar dan tetap berdiri sebagai Situs Warisan Dunia UNESCO sejak 1991.",
    "tags": ["prambanan", "candi-hindu", "sanjaya", "trimurti", "ramayana", "unesco"],
    "sumber": [],
    "tingkat_pembaca": "umum",
    "terakhir_diupdate": "2026-07-22"
  }
]
