[
  {
    "id": "sains.astronomi.bulan-bumi",
    "judul": "Bulan: Satelit Alami Bumi",
    "kategori": "sains",
    "subkategori": "astronomi",
    "periode": {
      "label": "Diperkirakan terbentuk sekitar 4,5 miliar tahun lalu"
    },
    "ringkasan": "Bulan adalah satu-satunya satelit alami bumi, diperkirakan terbentuk dari puing-puing tabrakan dahsyat antara bumi purba dengan benda langit seukuran Mars, dan berperan penting memengaruhi pasang surut air laut serta menstabilkan kemiringan poros bumi.",
    "konten": "Bulan adalah satu-satunya satelit alami yang mengorbit bumi, dan merupakan objek paling terang di langit malam karena memantulkan cahaya matahari ke permukaannya. Teori paling diterima luas tentang asal-usul bulan adalah hipotesis tabrakan raksasa, yang menyatakan bahwa sekitar 4,5 miliar tahun lalu, sebuah benda langit seukuran planet Mars (kadang disebut Theia) menabrak bumi purba yang masih dalam tahap pembentukan awal, melontarkan sejumlah besar material dari kerak bumi dan benda penabrak tersebut ke luar angkasa. Material yang terlontar ini kemudian berkumpul dan memadat akibat gravitasinya sendiri, membentuk bulan yang kita kenal sekarang, menjelaskan mengapa komposisi batuan bulan menunjukkan banyak kemiripan dengan batuan di kerak bumi.\n\nMeski ukurannya jauh lebih kecil dibanding bumi, bulan punya pengaruh gravitasi yang sangat penting bagi kehidupan di bumi. Pengaruh paling nyata adalah fenomena pasang surut air laut — gravitasi bulan menarik air laut di bagian bumi yang paling dekat dengannya, menciptakan tonjolan air yang kita rasakan sebagai air pasang, sementara bagian bumi yang berlawanan juga mengalami pasang akibat efek gaya sentrifugal dari perputaran sistem bumi-bulan. Selain pasang surut, keberadaan bulan juga berperan penting menstabilkan kemiringan poros rotasi bumi dalam jangka waktu sangat panjang, mencegah kemiringan tersebut berubah secara drastis dan tidak menentu, yang kalau terjadi bisa menyebabkan perubahan iklim ekstrem dan tidak stabil di bumi.\n\nBulan selalu menunjukkan sisi yang sama ke arah bumi, fenomena yang disebut terkunci secara pasang surut (tidally locked), terjadi karena periode rotasi bulan pada porosnya sendiri persis sama dengan periode revolusinya mengelilingi bumi, sekitar 27,3 hari, akibat pengaruh gravitasi bumi yang secara bertahap 'mengunci' rotasi bulan selama miliaran tahun. Inilah sebabnya manusia baru bisa melihat 'sisi jauh' bulan yang tidak pernah menghadap bumi lewat misi luar angkasa, karena sisi tersebut memang tidak pernah terlihat dari permukaan bumi dalam kondisi apa pun. Bulan juga menjadi satu-satunya benda langit selain bumi yang pernah diinjak langsung oleh manusia, dimulai dengan misi Apollo 11 pada 1969, yang membawa astronot Neil Armstrong dan Buzz Aldrin menjadi manusia pertama yang berjalan di permukaan bulan.",
    "tags": ["bulan", "satelit-alami", "hipotesis-tabrakan-raksasa", "pasang-surut", "apollo-11"],
    "sumber": [],
    "tingkat_pembaca": "umum",
    "terakhir_diupdate": "2026-10-18"
  },
  {
    "id": "sains.astronomi.asteroid-komet",
    "judul": "Asteroid dan Komet",
    "kategori": "sains",
    "subkategori": "astronomi",
    "periode": {
      "label": "Terbentuk bersamaan dengan tata surya, sekitar 4,6 miliar tahun lalu"
    },
    "ringkasan": "Asteroid dan komet adalah benda-benda langit kecil sisa pembentukan tata surya, dengan asteroid umumnya berupa batuan padat yang banyak ditemukan di sabuk asteroid, sementara komet tersusun dari es dan debu yang menghasilkan ekor spektakuler saat mendekati matahari.",
    "konten": "Asteroid adalah benda langit berukuran relatif kecil, tersusun terutama dari batuan dan logam, dianggap sebagai sisa material yang tidak sempat bergabung membentuk planet penuh pada masa awal pembentukan tata surya sekitar 4,6 miliar tahun lalu. Sebagian besar asteroid di tata surya kita ditemukan berkumpul di wilayah yang disebut sabuk asteroid, terletak di antara orbit Mars dan Jupiter, diperkirakan mengandung jutaan asteroid dengan berbagai ukuran, dari yang sekecil kerikil sampai yang terbesar bernama Ceres, yang ukurannya cukup besar sehingga diklasifikasikan sebagai planet kerdil. Meski jumlahnya sangat banyak, total massa seluruh asteroid di sabuk asteroid ini sebenarnya jauh lebih kecil dibanding massa bulan, menunjukkan bahwa ruang antar asteroid sebenarnya sangat luas dan jarang terjadi tabrakan, berbeda dari gambaran padat yang sering muncul dalam film fiksi ilmiah.\n\nKomet, berbeda dari asteroid, tersusun terutama dari campuran es (air beku, karbon dioksida beku, dan senyawa beku lainnya) bercampur debu dan batuan, sering dijuluki 'bola salju kotor' karena komposisinya ini. Komet umumnya berasal dari wilayah yang jauh lebih jauh di tata surya, seperti Sabuk Kuiper di luar orbit Neptunus, atau bahkan dari Awan Oort yang diperkirakan membentang jauh lebih jauh lagi, mengelilingi seluruh tata surya dalam bentuk kulit bola raksasa. Ketika orbit suatu komet membawanya mendekat ke arah matahari, panas matahari membuat es pada permukaan komet menyublim (berubah langsung dari padat menjadi gas), melepaskan gas dan debu yang membentuk 'koma', yaitu lapisan kabut yang mengelilingi inti komet, serta ekor panjang yang khas, selalu mengarah menjauhi matahari akibat dorongan angin matahari dan tekanan radiasi, tidak peduli ke arah mana komet tersebut sedang bergerak.\n\nBaik asteroid maupun komet sesekali bisa memasuki atmosfer bumi, dan kalau cukup kecil, biasanya akan terbakar habis akibat gesekan dengan atmosfer sebelum sempat mencapai permukaan, menciptakan fenomena yang kita kenal sebagai meteor atau 'bintang jatuh'. Namun pada kesempatan yang jauh lebih jarang, benda langit yang cukup besar bisa berhasil menembus atmosfer dan menghantam permukaan bumi, disebut meteorit, dengan dampak yang bisa sangat besar tergantung ukurannya — tabrakan asteroid besar diyakini menjadi salah satu penyebab utama kepunahan massal dinosaurus sekitar 66 juta tahun lalu, menjadikan pemantauan benda-benda langit yang berpotensi mendekati bumi sebagai salah satu fokus penting dalam astronomi modern demi keselamatan planet kita di masa depan.",
    "tags": ["asteroid", "komet", "sabuk-asteroid", "sabuk-kuiper", "meteor", "meteorit"],
    "sumber": [],
    "tingkat_pembaca": "umum",
    "terakhir_diupdate": "2026-10-18"
  }
]
